{
  "@context": [
    "https://www.w3.org/ns/credentials/v2",
    "https://ref.gs1.org/gs1/vc/declaration-context",
    "https://ref.gs1.org/gs1/vc/product-context",
    "https://w3id.org/vc/render-method/v1",
    {
      "gs1": "https://gs1.org/voc/",
      "schema": "https://schema.org/",
      "xsd": "http://www.w3.org/2001/XMLSchema#"
    }
  ],
  "type": [
    "VerifiableCredential",
    "DataCredential",
    "AssetCredential"
  ],
  "issuer": {
    "id": "did:web:gs1.github.io:GS1DigitalLicenses:dids:fake_mc_did",
    "name": "Healthy Tots"
  },
  "id": "https://gs1.github.io/GS1DigitalLicenses/samples/sscc-data-credential-sample.jwt",
  "validFrom": "2025-07-01T12:30:00.000Z",
  "name": "Custom Shipment Data Credential",
  "description": "THIS GS1 DIGITAL LICENSE CREDENTIAL IS FOR TESTING PURPOSES ONLY. The data credential is the Verifiable Credential that is shared with parties interested in the basic information associated with GS1 ID Key.",
  "credentialSubject": {
    "id": "https://id.gs1.org/8003/0810159550017",
    "keyAuthorization": "https://gs1.github.io/GS1DigitalLicenses/samples/grai-key-credential-sample.jwt",
    "type": "gs1:ReturnableAsset",

    "gs1:assetType": {
      "@id": "https://example.com/vocab/crate",
      "gs1:descriptionShort": "Plastic Beverage Crate"
    },

    "gs1:owner": {
      "@type": "gs1:Organization",
      "gs1:gln": "9506000000003"
    },

    "gs1:hasLocation": {
      "@type": "gs1:Place",
      "gs1:gln": "9506000000004",
      "gs1:descriptionShort": "Distribution Center B"
    },

    "gs1:status": {
      "@id": "gs1:InUse"
    },

    "gs1:material": "HDPE",
    "gs1:dimensionUnit": "gs1:centimetre",
    "gs1:depth": { "@value": "60", "@type": "xsd:decimal" },
    "gs1:width": { "@value": "40", "@type": "xsd:decimal" },
    "gs1:height": { "@value": "30", "@type": "xsd:decimal" },

    "gs1:grossWeight": {
      "@value": "3.5",
      "@type": "xsd:decimal"
    },

    "gs1:handlingInstructions": [
      { "@value": "Do not stack more than 5 high" },
      { "@value": "Clean before reuse" }
    ]
  },
  "credentialSchema": {
    "id": "https://gs1.github.io/GS1DigitalLicenses/schemas/custom_asset.json",
    "type": "JsonSchema"
  },
  "credentialStatus": {
    "id": "https://gs1.github.io/GS1DigitalLicenses/status/mc_status_list.jwt#18932",
    "type": "BitstringStatusListEntry",
    "statusPurpose": "revocation",
    "statusListIndex": "18932",
    "statusListCredential": "https://gs1.github.io/GS1DigitalLicenses/status/mc_status_list.jwt"
  },
  "renderMethod": [
    {
      "type": "TemplateRenderMethod",
      "renderSuite": "svg-mustache",
      "name": "Web Display",
      "template": {
        "id": "https://gs1.github.io/GS1DigitalLicenses/templates/gs1-sample-product-data-template.svg",
        "mediaType": "image/svg+xml",
        "digestMultibase": "uEiBicoLE4OH64LWQKkGd5zWCtYymxQsAJdbrmCPDWO7qaw"
      }
    }
  ]
}